{
  "events": [
    {
      "nickname": "andy",
      "rack": "GPY",
      "cumulative": 18,
      "row": 7,
      "column": 6,
      "position": "8G",
      "played_tiles": "GYP",
      "score": 18,
      "words_formed": ["GYP"]
    },
    {
      "nickname": "cesar",
      "note": "-3.5 seems like 7H AURA or 7I UTA are good. i did consider keeping the Z, but i couldn't think of a good play. but AIRTU kind of sucks, too.",
      "rack": "AAIRTUZ",
      "cumulative": 16,
      "row": 6,
      "column": 5,
      "position": "7F",
      "played_tiles": "ZA",
      "score": 16,
      "words_formed": ["ZA", "AG"]
    },
    {
      "nickname": "andy",
      "rack": "EHTW",
      "cumulative": 40,
      "row": 5,
      "column": 6,
      "position": "6G",
      "played_tiles": "THEW",
      "score": 22,
      "words_formed": ["THEW", "TAG"]
    },
    {
      "nickname": "cesar",
      "rack": "AIMRTTU",
      "cumulative": 37,
      "row": 4,
      "column": 8,
      "position": "5I",
      "played_tiles": "MAUT",
      "score": 21,
      "words_formed": ["MAUT", "ME", "AW"]
    },
    {
      "nickname": "andy",
      "rack": "JLO",
      "cumulative": 62,
      "row": 1,
      "column": 11,
      "direction": 1,
      "position": "L2",
      "played_tiles": "JOL.",
      "score": 22,
      "words_formed": ["JOLT"]
    },
    {
      "nickname": "cesar",
      "rack": "FIIORTT",
      "cumulative": 60,
      "column": 12,
      "direction": 1,
      "position": "M1",
      "played_tiles": "TORI",
      "score": 23,
      "words_formed": ["TORI", "JO", "OR", "LI"]
    },
    {
      "nickname": "andy",
      "rack": "BDE",
      "cumulative": 105,
      "row": 1,
      "column": 13,
      "direction": 1,
      "position": "N2",
      "played_tiles": "BED",
      "score": 43,
      "words_formed": ["BED", "JOB", "ORE", "LID"]
    },
    {
      "nickname": "cesar",
      "rack": "FIILRST",
      "cumulative": 74,
      "row": 6,
      "column": 9,
      "position": "7J",
      "played_tiles": "LIFT",
      "score": 14,
      "words_formed": ["LIFT", "AWL"]
    },
    {
      "nickname": "andy",
      "rack": "ABEIIRX",
      "type": 4,
      "cumulative": 105,
      "exchanged": "IIAB"
    },
    {
      "nickname": "cesar",
      "note": "i missed SORdINI. SIgNIOR is better defensively too, i wasn't 100% on it. -4.5",
      "rack": "?IINORS",
      "cumulative": 151,
      "row": 3,
      "column": 14,
      "direction": 1,
      "position": "O4",
      "played_tiles": "ORIgINS",
      "score": 77,
      "is_bingo": true,
      "words_formed": ["ORIGINS", "LIDO"]
    },
    {
      "nickname": "andy",
      "rack": "?DEHRRU",
      "cumulative": 170,
      "row": 9,
      "column": 7,
      "position": "10H",
      "played_tiles": "DRUtHER.",
      "score": 65,
      "is_bingo": true,
      "words_formed": ["DRUTHERS"]
    },
    {
      "nickname": "cesar",
      "note": "i should not try to play defense when i'm down. how many times do i have to tell myself that? ABEL is better than ABE too. MOO is definitely better than my move. DOABLE is best which i just missed. (-6.5)",
      "rack": "ABELMOO",
      "cumulative": 176,
      "row": 10,
      "column": 9,
      "position": "11J",
      "played_tiles": "MOOL",
      "score": 25,
      "words_formed": ["MOOL", "UM", "TO", "HO", "EL"]
    },
    {
      "nickname": "andy",
      "rack": "ACEIT",
      "cumulative": 206,
      "row": 9,
      "column": 7,
      "direction": 1,
      "position": "H10",
      "played_tiles": ".ACITE",
      "score": 36,
      "words_formed": ["DACITE"]
    },
    {
      "nickname": "cesar",
      "rack": "ABEFGIN",
      "cumulative": 204,
      "row": 11,
      "column": 11,
      "position": "12L",
      "played_tiles": "EF",
      "score": 28,
      "words_formed": ["EF", "HOE", "ELF"]
    },
    {
      "nickname": "andy",
      "rack": "AEEGISS",
      "cumulative": 277,
      "row": 4,
      "position": "5A",
      "played_tiles": "AEGISES",
      "score": 71,
      "is_bingo": true,
      "words_formed": ["AEGISES", "STAG"]
    },
    {
      "nickname": "cesar",
      "note": "quackle thinks i should go for the leave by playing 4A BOA. it is probably right. (-2)",
      "rack": "AABGINO",
      "cumulative": 240,
      "row": 3,
      "direction": 1,
      "position": "A4",
      "played_tiles": "B.GNIO",
      "score": 36,
      "words_formed": ["BAGNIO"]
    },
    {
      "nickname": "andy",
      "rack": "UV",
      "cumulative": 291,
      "row": 2,
      "column": 2,
      "direction": 1,
      "position": "C3",
      "played_tiles": "VU.",
      "score": 14,
      "words_formed": ["VUG"]
    },
    {
      "nickname": "cesar",
      "rack": "AAACESW",
      "cumulative": 265,
      "column": 12,
      "position": "1M",
      "played_tiles": ".AW",
      "score": 25,
      "words_formed": ["TAW", "ABED"]
    },
    {
      "nickname": "andy",
      "rack": "AUV",
      "cumulative": 306,
      "row": 13,
      "column": 5,
      "position": "14F",
      "played_tiles": "VA.U",
      "score": 15,
      "words_formed": ["VATU"]
    },
    {
      "nickname": "cesar",
      "note": "damn vatu. DAMN IT. stupid game. i missed MOOLA, N9 ERA seems to be good there because it also sets up DELFS or something like that that i may need. DAN's leave isn't strong enough. -7",
      "rack": "AACDEES",
      "cumulative": 283,
      "row": 8,
      "column": 12,
      "position": "9M",
      "played_tiles": "DA.",
      "score": 18,
      "words_formed": ["DAN", "DELF", "AR"]
    },
    {
      "nickname": "andy",
      "rack": "EENRTX",
      "cumulative": 366,
      "row": 8,
      "column": 1,
      "direction": 1,
      "position": "B9",
      "played_tiles": "EXTERN",
      "score": 60,
      "words_formed": ["EXTERN", "OE"]
    },
    {
      "nickname": "cesar",
      "rack": "ACEELPS",
      "cumulative": 318,
      "row": 14,
      "position": "15A",
      "played_tiles": "CEP",
      "score": 35,
      "words_formed": ["CEP", "EXTERNE"]
    },
    {
      "nickname": "andy",
      "rack": "KNO",
      "cumulative": 392,
      "row": 11,
      "position": "12A",
      "played_tiles": "K.NO",
      "score": 26,
      "words_formed": ["KENO"]
    },
    {
      "nickname": "cesar",
      "note": "no chance he's gonna leave it open. raya. -7",
      "rack": "AAELNSY",
      "cumulative": 339,
      "row": 12,
      "column": 1,
      "position": "13B",
      "played_tiles": ".AY",
      "score": 21,
      "words_formed": ["RAY", "NA", "OY"]
    },
    {
      "nickname": "andy",
      "note": "15G D(E)NIER to block my out.",
      "rack": "DEIINQR",
      "cumulative": 423,
      "row": 5,
      "column": 13,
      "position": "6N",
      "played_tiles": "Q.",
      "score": 31,
      "words_formed": ["QI"]
    },
    {
      "nickname": "cesar",
      "note": "SOL is better than going out. -4",
      "rack": "AELNOS",
      "cumulative": 349,
      "row": 14,
      "column": 7,
      "position": "15H",
      "played_tiles": ".NOLASE",
      "score": 10,
      "words_formed": ["ENOLASE", "UN"]
    },
    {
      "nickname": "cesar",
      "rack": "DEINIR",
      "type": 5,
      "cumulative": 363,
      "end_rack_points": 14
    }
  ],
  "players": [
    {
      "nickname": "andy",
      "real_name": "andy"
    },
    {
      "nickname": "cesar",
      "real_name": "cesar"
    }
  ],
  "lexicon": "NWL20",
  "version": 1,
  "final_scores": [423, 363],
  "play_state": 2,
  "original_gcg": "#player1 andy andy\n#player2 cesar cesar\n>andy: GPY 8G GYP +18 18\n>cesar: AAIRTUZ 7F ZA +16 16\n#note -3.5 seems like 7H AURA or 7I UTA are good. i did consider keeping the Z, but i couldn't think of a good play. but AIRTU kind of sucks, too.\n>andy: EHTW 6G THEW +22 40\n>cesar: AIMRTTU 5I MAUT +21 37\n>andy: JLO L2 JOL. +22 62\n>cesar: FIIORTT M1 TORI +23 60\n>andy: BDE N2 BED +43 105\n>cesar: FIILRST 7J LIFT +14 74\n>andy: ABEIIRX -IIAB +0 105\n>cesar: ?IINORS O4 ORIgINS +77 151\n#note i missed SORdINI. SIgNIOR is better defensively too, i wasn't 100% on it. -4.5\n>andy: ?DEHRRU 10H DRUtHER. +65 170\n>cesar: ABELMOO 11J MOOL +25 176\n#note i should not try to play defense when i'm down. how many times do i have to tell myself that? ABEL is better than ABE too. MOO is definitely better than my move. DOABLE is best which i just missed. (-6.5)\n>andy: ACEIT H10 .ACITE +36 206\n>cesar: ABEFGIN 12L EF +28 204\n>andy: AEEGISS 5A AEGISES +71 277\n>cesar: AABGINO A4 B.GNIO +36 240\n#note quackle thinks i should go for the leave by playing 4A BOA. it is probably right. (-2)\n>andy: UV C3 VU. +14 291\n>cesar: AAACESW 1M .AW +25 265\n>andy: AUV 14F VA.U +15 306\n>cesar: AACDEES 9M DA. +18 283\n#note damn vatu. DAMN IT. stupid game. i missed MOOLA, N9 ERA seems to be good there because it also sets up DELFS or something like that that i may need. DAN's leave isn't strong enough. -7\n>andy: EENRTX B9 EXTERN +60 366\n>cesar: ACEELPS 15A CEP +35 318\n>andy: KNO 12A K.NO +26 392\n>cesar: AAELNSY 13B .AY +21 339\n#note no chance he's gonna leave it open. raya. -7\n>andy: DEIINQR 6N Q. +31 423\n#note 15G D(E)NIER to block my out.\n>cesar: AELNOS 15H .NOLASE +10 349\n#note SOL is better than going out. -4\n>cesar:  (DEINIR) +14 363"
}
