{
  "events": [
    {
      "nickname": "cesar",
      "note": "an auspicious beginning. as a side note, i almost hate being obviously lucky as much as i hate being unlucky. caldera is better because it doesn't expose the vowels.",
      "rack": "?AACDER",
      "cumulative": 74,
      "row": 7,
      "column": 3,
      "position": "8D",
      "played_tiles": "CRAAlED",
      "score": 74,
      "is_bingo": true,
      "words_formed": ["CRAALED"]
    },
    {
      "nickname": "frentz",
      "note": "ok good, now i can stop feeling bad about being lucky!",
      "rack": "DEENOSW",
      "cumulative": 74,
      "row": 1,
      "column": 4,
      "direction": 1,
      "position": "E2",
      "played_tiles": "ENDOWE.S",
      "score": 74,
      "is_bingo": true,
      "words_formed": ["ENDOWERS"]
    },
    {
      "nickname": "cesar",
      "note": "couldn't pull the trigger on WAI# unfortunately. wasn't sure if it was that or my friend Wei. (-8)",
      "rack": "AABEIIW",
      "cumulative": 102,
      "row": 3,
      "column": 3,
      "direction": 1,
      "position": "D4",
      "played_tiles": "AWA",
      "score": 28,
      "words_formed": ["AWA", "AD", "WO", "AW"]
    },
    {
      "nickname": "frentz",
      "rack": "KNOO",
      "cumulative": 104,
      "row": 1,
      "column": 5,
      "direction": 1,
      "position": "F2",
      "played_tiles": "NOOK",
      "score": 30,
      "words_formed": ["NOOK", "EN", "NO", "ADO", "WOK"]
    },
    {
      "nickname": "cesar",
      "note": "quackle also likes this better than the 37 pointer",
      "rack": "BEGIIJX",
      "cumulative": 137,
      "row": 8,
      "column": 6,
      "position": "9G",
      "played_tiles": "XI",
      "score": 35,
      "words_formed": ["XI", "AX", "LI"]
    },
    {
      "nickname": "frentz",
      "rack": "EPY",
      "cumulative": 134,
      "row": 9,
      "column": 5,
      "position": "10F",
      "played_tiles": "YEP",
      "score": 30,
      "words_formed": ["YEP", "AXE", "LIP"]
    },
    {
      "nickname": "cesar",
      "rack": "BEFGIIJ",
      "cumulative": 168,
      "row": 10,
      "column": 2,
      "position": "11C",
      "played_tiles": "JIBE",
      "score": 31,
      "words_formed": ["JIBE", "YE"]
    },
    {
      "nickname": "frentz",
      "rack": "AEFS",
      "cumulative": 171,
      "row": 11,
      "column": 1,
      "position": "12B",
      "played_tiles": "SAFE",
      "score": 37,
      "words_formed": ["SAFE", "JA", "IF", "BE"]
    },
    {
      "nickname": "cesar",
      "note": "unfortunately i don't know collins strategy enough to know if keeping the horrible leave for 39 points is worth it, but an exchange is too far behind. now JAI# i remember. it's still not a word.",
      "rack": "FGIIIOU",
      "cumulative": 207,
      "row": 12,
      "column": 2,
      "position": "13C",
      "played_tiles": "IF",
      "score": 39,
      "words_formed": ["IF", "JAI", "IFF"]
    },
    {
      "nickname": "frentz",
      "rack": "GLU",
      "cumulative": 190,
      "row": 13,
      "position": "14A",
      "played_tiles": "GUL",
      "score": 19,
      "words_formed": ["GUL", "JAIL"]
    },
    {
      "nickname": "cesar",
      "note": "ourie is better, but i wasn't sure enough of LIPO#. this 5-pt challenge is pretty lame by the way. (-1.5)",
      "rack": "EGIIORU",
      "cumulative": 220,
      "row": 10,
      "column": 7,
      "position": "11H",
      "played_tiles": "EUOI",
      "score": 13,
      "words_formed": ["EUOI", "LIPE"]
    },
    {
      "nickname": "frentz",
      "note": "dammit",
      "rack": "EEILRST",
      "cumulative": 276,
      "row": 14,
      "column": 2,
      "position": "15C",
      "played_tiles": "STERILE",
      "score": 86,
      "is_bingo": true,
      "words_formed": ["STERILE", "JAILS"]
    },
    {
      "nickname": "cesar",
      "rack": "EGILORR",
      "cumulative": 237,
      "row": 9,
      "column": 9,
      "position": "10J",
      "played_tiles": "GOR",
      "score": 17,
      "words_formed": ["GOR", "GO", "OI"]
    },
    {
      "nickname": "frentz",
      "rack": "MTU",
      "cumulative": 293,
      "row": 13,
      "column": 4,
      "position": "14E",
      "played_tiles": "TUM",
      "score": 17,
      "words_formed": ["TUM", "TE", "UR", "MI"]
    },
    {
      "nickname": "cesar",
      "rack": "EIILNRV",
      "cumulative": 315,
      "row": 2,
      "column": 4,
      "position": "3E",
      "played_tiles": "..NVIRILE",
      "score": 78,
      "is_bingo": true,
      "words_formed": ["NONVIRILE"]
    },
    {
      "nickname": "cesar",
      "note": "that took guts!!",
      "rack": "ADDIPYZ",
      "type": 3,
      "cumulative": 320,
      "bonus": 5
    },
    {
      "nickname": "frentz",
      "note": "unfortunately, thanks to the lame challenge rule i don't get a chance to come back a bit more",
      "rack": "?ABCEER",
      "cumulative": 373,
      "row": 12,
      "column": 6,
      "position": "13G",
      "played_tiles": "ACErBER",
      "score": 80,
      "is_bingo": true,
      "words_formed": ["ACERBER", "AMI"]
    },
    {
      "nickname": "cesar",
      "rack": "ADDIPYZ",
      "cumulative": 365,
      "column": 7,
      "direction": 1,
      "position": "H1",
      "played_tiles": "DA.Y",
      "score": 45,
      "words_formed": ["DAVY"]
    },
    {
      "nickname": "frentz",
      "rack": "GOUV",
      "cumulative": 399,
      "column": 11,
      "direction": 1,
      "position": "L1",
      "played_tiles": "VU.GO",
      "score": 26,
      "words_formed": ["VULGO"]
    },
    {
      "nickname": "cesar",
      "note": "what do you guys think? PUTZ may be a tiny bit better because of the leave. the pool is clunky. this is an interesting move. i just wanted points unfortunately (but ZIP is too ugly). i guess drawing the Q here for me is not a bad thing, but maybe eliminating that volatility with PUTZ ends up being better.. but that barely puts me ahead. not sure what's right.",
      "rack": "DINPTTZ",
      "cumulative": 411,
      "row": 4,
      "column": 10,
      "direction": 1,
      "position": "K5",
      "played_tiles": "ZIT",
      "score": 46,
      "words_formed": ["ZIT", "ZO"]
    },
    {
      "nickname": "frentz",
      "note": "crappity crap crap",
      "rack": "HOQT",
      "cumulative": 446,
      "row": 1,
      "column": 10,
      "position": "2K",
      "played_tiles": "Q.OTH",
      "score": 47,
      "words_formed": ["QUOTH", "QI", "OE"]
    },
    {
      "nickname": "cesar",
      "note": "i wanted to see if there was a word like HANDPOT  or something insane like that but couldn't see anything. quackle suggests i am totally screwed, but J5 AD gives me a supposedly tiny shot of 2.78%. don't see how. POND gives me the same win % but a lower \"equity\". i was pretty sure i was screwed but was trying to get an out play with the best leave i could",
      "rack": "ADNNOPT",
      "cumulative": 439,
      "row": 11,
      "column": 11,
      "position": "12L",
      "played_tiles": "POND",
      "score": 28,
      "words_formed": ["POND", "PE", "OR"]
    },
    {
      "nickname": "frentz",
      "rack": "AILMNRS",
      "cumulative": 529,
      "row": 5,
      "column": 14,
      "direction": 1,
      "position": "O6",
      "played_tiles": "RIMLAN.S",
      "score": 83,
      "is_bingo": true,
      "words_formed": ["RIMLANDS"]
    },
    {
      "nickname": "frentz",
      "note": "lame",
      "type": 3,
      "cumulative": 534,
      "bonus": 5
    },
    {
      "nickname": "frentz",
      "rack": "AHNTT",
      "type": 5,
      "cumulative": 550,
      "end_rack_points": 16
    }
  ],
  "players": [
    { "nickname": "cesar", "real_name": "cesar" },
    { "nickname": "frentz", "real_name": "frentz" }
  ],
  "version": 1,
  "winner": 1,
  "original_gcg": "#player1 cesar cesar\n#player2 frentz frentz\n\u003ecesar: ?AACDER 8D CRAAlED +74 74\n#note an auspicious beginning. as a side note, i almost hate being obviously lucky as much as i hate being unlucky. caldera is better because it doesn't expose the vowels.\n\u003efrentz: DEENOSW E2 ENDOWE.S +74 74\n#note ok good, now i can stop feeling bad about being lucky!\n\u003ecesar: AABEIIW D4 AWA +28 102\n#note couldn't pull the trigger on WAI# unfortunately. wasn't sure if it was that or my friend Wei. (-8)\n\u003efrentz: KNOO F2 NOOK +30 104\n\u003ecesar: BEGIIJX 9G XI +35 137\n#note quackle also likes this better than the 37 pointer\n\u003efrentz: EPY 10F YEP +30 134\n\u003ecesar: BEFGIIJ 11C JIBE +31 168\n\u003efrentz: AEFS 12B SAFE +37 171\n\u003ecesar: FGIIIOU 13C IF +39 207\n#note unfortunately i don't know collins strategy enough to know if keeping the horrible leave for 39 points is worth it, but an exchange is too far behind. now JAI# i remember. it's still not a word.\n\u003efrentz: GLU 14A GUL +19 190\n\u003ecesar: EGIIORU 11H EUOI +13 220\n#note ourie is better, but i wasn't sure enough of LIPO#. this 5-pt challenge is pretty lame by the way. (-1.5)\n\u003efrentz: EEILRST 15C STERILE +86 276\n#note dammit\n\u003ecesar: EGILORR 10J GOR +17 237\n\u003efrentz: MTU 14E TUM +17 293\n\u003ecesar: EIILNRV 3E ..NVIRILE +78 315\n\u003ecesar: ADDIPYZ (challenge) +5 320\n#note that took guts!!\n\u003efrentz: ?ABCEER 13G ACErBER +80 373\n#note unfortunately, thanks to the lame challenge rule i don't get a chance to come back a bit more\n\u003ecesar: ADDIPYZ H1 DA.Y +45 365\n\u003efrentz: GOUV L1 VU.GO +26 399\n\u003ecesar: DINPTTZ K5 ZIT +46 411\n#note what do you guys think? PUTZ may be a tiny bit better because of the leave. the pool is clunky. this is an interesting move. i just wanted points unfortunately (but ZIP is too ugly). i guess drawing the Q here for me is not a bad thing, but maybe eliminating that volatility with PUTZ ends up being better.. but that barely puts me ahead. not sure what's right.\n\u003efrentz: HOQT 2K Q.OTH +47 446\n#note crappity crap crap\n\u003ecesar: ADNNOPT 12L POND +28 439\n#note i wanted to see if there was a word like HANDPOT  or something insane like that but couldn't see anything. quackle suggests i am totally screwed, but J5 AD gives me a supposedly tiny shot of 2.78%. don't see how. POND gives me the same win % but a lower \"equity\". i was pretty sure i was screwed but was trying to get an out play with the best leave i could\n\u003efrentz: AILMNRS O6 RIMLAN.S +83 529\n\u003efrentz:  (challenge) +5 534\n#note lame\n\u003efrentz:  (AHNTT) +16 550",
  "lexicon": "CSW12",
  "play_state": 2,
  "final_scores": [439, 550]
}
